{
  "format": "FGMP/1",
  "identity": {
    "id": "307e943c-3712-4b90-a4cc-000000000002", "revision": 1,
    "name": "阿克曼四灯农机", "author": "刘泽禹", "manufacturer": "",
    "description": "仅用于离线测试的参数和灯光报文示例，不代表实际执行器已支持。",
    "commissioned": false, "legacyMachineId": 18, "legacyProtocolId": 514
  },
  "machine": {
    "type": "ackermann", "inputModel": "calibrated_virtual_differential",
    "geometry": { "trackMm": 1200, "wheelbaseMm": 1800 },
    "calibration": { "wheelSpeedAt100PercentMmS": 2000, "maxSteeringMrad": 600, "minimumMovingMmS": 50 }
  },
  "upstream": { "protocol": "three_in_one_can_v1", "bus": "CAN1", "bitrate": 250000 },
  "downstream": { "bus": "CAN0", "bitrate": 1000000 },
  "safety": { "commandTimeoutMs": 500, "feedbackTimeoutMs": 1500, "neutralBeforeEnable": true, "requiredFeedbackIds": [1330] },
  "routing": {
    "mode": "mapped_can", "feedbackPassthroughIds": [1330,1616,1618],
    "messages": [
      { "id": 385, "domain": "drive", "counter": "none", "checksum": "none", "base": [0,0,0,0,0,0,0,0], "fields": [
        { "source": "drive.forwardMmS", "startBit": 0, "bitLength": 16, "signed": true, "byteOrder": "big_byte_aligned", "numerator": 1, "denominator": 1, "offset": 0, "safeRaw": 0 },
        { "source": "drive.leftSteeringMrad", "startBit": 32, "bitLength": 16, "signed": true, "byteOrder": "big_byte_aligned", "numerator": 1, "denominator": 1, "offset": 0, "safeRaw": 0 }
      ] },
      { "id": 528, "domain": "drive", "counter": "nibble6", "checksum": "xor7", "base": [0,0,0,0,0,0,0,0], "fields": [
        { "source": "lighting.headlight", "startBit": 0, "bitLength": 1, "signed": false, "byteOrder": "little", "numerator": 1, "denominator": 1, "offset": 0, "safeRaw": 0 },
        { "source": "lighting.headlight", "startBit": 1, "bitLength": 1, "signed": false, "byteOrder": "little", "numerator": 1, "denominator": 1, "offset": 0, "safeRaw": 0 },
        { "source": "lighting.headlight", "startBit": 2, "bitLength": 1, "signed": false, "byteOrder": "little", "numerator": 1, "denominator": 1, "offset": 0, "safeRaw": 0 },
        { "source": "lighting.headlight", "startBit": 3, "bitLength": 1, "signed": false, "byteOrder": "little", "numerator": 1, "denominator": 1, "offset": 0, "safeRaw": 0 }
      ] }
    ]
  },
  "devices": [
    { "id": "drive", "name": "行走驱动", "category": "drive", "control": "drive.forwardMmS", "feedback": "none", "outputMessageId": 385 },
    { "id": "steering", "name": "转向执行器", "category": "steering", "control": "drive.leftSteeringMrad", "feedback": "none", "outputMessageId": 385 },
    { "id": "light_1", "name": "照明一", "category": "light", "control": "lighting.headlight", "feedback": "none", "outputMessageId": 528, "channel": 0 },
    { "id": "light_2", "name": "照明二", "category": "light", "control": "lighting.headlight", "feedback": "none", "outputMessageId": 528, "channel": 1 },
    { "id": "light_3", "name": "照明三", "category": "light", "control": "lighting.headlight", "feedback": "none", "outputMessageId": 528, "channel": 2 },
    { "id": "light_4", "name": "照明四", "category": "light", "control": "lighting.headlight", "feedback": "none", "outputMessageId": 528, "channel": 3 },
    { "id": "safety", "name": "安全状态", "category": "safety", "control": "none", "feedback": "native_three_in_one", "feedbackFrameId": 1330 },
    { "id": "battery", "name": "电池组", "category": "battery", "control": "none", "feedback": "native_three_in_one", "feedbackFrameId": 1616 }
  ],
  "extensions": {
    "example:limitations": "0x181 沿用现有转向运动协议格式；0x210 是自定义灯光示例，实际设备须支持。四路联动，不能独立寻址。0x532 必须由真实安全状态源提供，不能虚构健康帧。安全转角、转向变化率和失联处理须在执行器侧落实后再完成台架验证。"
  }
}
