{
  "format": "FGMP/1",
  "identity": {
    "id": "307e943c-3712-4b90-a4cc-000000000003", "revision": 1,
    "name": "差速作业农机", "author": "刘泽禹", "manufacturer": "", "commissioned": false,
    "description": "离线映射示例：运动协议加自定义作业输出，参数和作业节点须核实。", "legacyMachineId": 16, "legacyProtocolId": 513
  },
  "machine": {
    "type": "differential", "inputModel": "calibrated_virtual_differential",
    "geometry": { "trackMm": 1000, "wheelbaseMm": 1400 },
    "calibration": { "wheelSpeedAt100PercentMmS": 2000, "maxSteeringMrad": 600, "minimumMovingMmS": 50 }
  },
  "upstream": { "protocol": "three_in_one_can_v1", "bus": "CAN1", "bitrate": 250000 },
  "downstream": { "bus": "CAN0", "bitrate": 1000000 },
  "safety": { "commandTimeoutMs": 500, "feedbackTimeoutMs": 1500, "neutralBeforeEnable": true, "requiredFeedbackIds": [1330] },
  "routing": {
    "mode": "mapped_can", "feedbackPassthroughIds": [1330,1616,1618],
    "messages": [
      { "id": 385, "domain": "drive", "counter": "none", "checksum": "none", "base": [0,0,0,0,0,0,0,0], "fields": [
        { "source": "drive.forwardMmS", "startBit": 0, "bitLength": 16, "signed": true, "byteOrder": "big_byte_aligned", "numerator": 1, "denominator": 1, "offset": 0, "safeRaw": 0 },
        { "source": "drive.yawMradS", "startBit": 32, "bitLength": 16, "signed": true, "byteOrder": "big_byte_aligned", "numerator": 1, "denominator": 1, "offset": 0, "safeRaw": 0 }
      ] },
      { "id": 530, "domain": "work", "counter": "nibble6", "checksum": "xor7", "base": [0,0,0,0,0,0,0,0], "fields": [
        { "source": "work.fanGear", "startBit": 0, "bitLength": 4, "signed": false, "byteOrder": "little", "numerator": 1, "denominator": 1, "offset": 0, "safeRaw": 0 },
        { "source": "work.pumpGear", "startBit": 4, "bitLength": 4, "signed": false, "byteOrder": "little", "numerator": 1, "denominator": 1, "offset": 0, "safeRaw": 0 },
        { "source": "work.shredderX100", "startBit": 8, "bitLength": 16, "signed": false, "byteOrder": "little", "numerator": 1, "denominator": 1, "offset": 0, "safeRaw": 0 }
      ] }
    ]
  },
  "devices": [
    { "id": "drive", "name": "行走驱动", "category": "drive", "control": "drive.forwardMmS", "feedback": "none", "outputMessageId": 385 },
    { "id": "fan", "name": "植保风机", "category": "fan", "control": "work.fanGear", "feedback": "none", "outputMessageId": 530 },
    { "id": "pump", "name": "供液水泵", "category": "pump", "control": "work.pumpGear", "feedback": "none", "outputMessageId": 530 },
    { "id": "shredder", "name": "碎枝机", "category": "shredder", "control": "work.shredderX100", "feedback": "none", "outputMessageId": 530 },
    { "id": "safety", "name": "安全状态", "category": "safety", "control": "none", "feedback": "native_three_in_one", "feedbackFrameId": 1330 }
  ],
  "extensions": { "example:limitations": "0x212 为自定义作业示例，实际执行器须明确支持。必须有真实 0x532 安全状态源；当前不合成异构设备健康状态。" }
}
